{
  "$schema": "../schemas/changelog.schema.json",
  "catalog": {
    "added": [
      "drive-disc:moonlight-lullaby",
      "drive-disc:white-water-ballad",
      "drive-disc:wuthering-salon",
      "drive-disc:yunkui-tales",
      "w-engine:cauldron-of-clarity",
      "w-engine:cinder-cobalt",
      "w-engine:joyau-dore",
      "w-engine:qingming-birdcage"
    ],
    "changed": [],
    "removed": []
  },
  "claims": {
    "added": [
      {
        "id": "clm_drive_disc_4a398533abe3",
        "kind": "drive_disc",
        "slotKey": "drive_disc:velina:general",
        "sourceId": "zzz-build"
      },
      {
        "id": "clm_drive_disc_6454aa1e0a99",
        "kind": "drive_disc",
        "slotKey": "drive_disc:yixuan:general",
        "sourceId": "game8"
      },
      {
        "id": "clm_drive_disc_995d16381a00",
        "kind": "drive_disc",
        "slotKey": "drive_disc:ye-shunguang:general",
        "sourceId": "prydwen"
      },
      {
        "id": "clm_drive_disc_9eba979fc049",
        "kind": "drive_disc",
        "slotKey": "drive_disc:yixuan:general",
        "sourceId": "zzz-build"
      },
      {
        "id": "clm_drive_disc_a8d394f11a50",
        "kind": "drive_disc",
        "slotKey": "drive_disc:miyabi:general",
        "sourceId": "zzz-build"
      },
      {
        "id": "clm_w_engine_644c8d7c7d37",
        "kind": "w_engine",
        "slotKey": "w_engine:yixuan:general",
        "sourceId": "game8"
      },
      {
        "id": "clm_w_engine_ee8d97ab7675",
        "kind": "w_engine",
        "slotKey": "w_engine:velina:general",
        "sourceId": "zzz-build"
      },
      {
        "id": "clm_w_engine_fcf020efd385",
        "kind": "w_engine",
        "slotKey": "w_engine:yixuan:general",
        "sourceId": "zzz-build"
      }
    ],
    "changed": [],
    "refreshed": [
      {
        "id": "clm_f2p_option_943c0751683b",
        "kind": "f2p_option",
        "slotKey": "f2p_option:yixuan:team:anby+soukaku+yixuan:general",
        "sourceId": "game8"
      },
      {
        "id": "clm_team_a46cf5f74284",
        "kind": "team",
        "slotKey": "team:anby+soukaku+yixuan:general",
        "sourceId": "game8"
      },
      {
        "id": "clm_team_e5152f9de4cf",
        "kind": "team",
        "slotKey": "team:dialyn+lucia+yixuan:general",
        "sourceId": "game8"
      }
    ],
    "removed": [],
    "statusChanged": []
  },
  "fromVersion": "3.3-r1",
  "generatedAt": "2026-10-27T19:21:48.036Z",
  "toVersion": "3.3-r2"
}
