{
  "$schema": "../../schemas/changelog.schema.json",
  "catalog": {
    "added": [
      "agent:anby",
      "agent:anton",
      "agent:astra-yao",
      "agent:ben",
      "agent:billy",
      "agent:burnice",
      "agent:caesar",
      "agent:corin",
      "agent:ellen",
      "agent:evelyn",
      "agent:grace",
      "agent:harumasa",
      "agent:hugo",
      "agent:jane-doe",
      "agent:koleda",
      "agent:lighter",
      "agent:lucy",
      "agent:lycaon",
      "agent:miyabi",
      "agent:nekomata",
      "agent:nicole",
      "agent:piper",
      "agent:pulchra",
      "agent:qingyi",
      "agent:rina",
      "agent:seth",
      "agent:soldier-0-anby",
      "agent:soldier-11",
      "agent:soukaku",
      "agent:trigger",
      "agent:vivian",
      "agent:yanagi",
      "agent:zhu-yuan",
      "bangboo:amillion",
      "bangboo:bagboo",
      "bangboo:butler",
      "bangboo:exploreboo",
      "bangboo:penguinboo",
      "bangboo:plugboo",
      "bangboo:rocketboo",
      "bangboo:sharkboo",
      "drive-disc:astral-voice",
      "drive-disc:branch-blade-song",
      "drive-disc:chaos-jazz",
      "drive-disc:chaotic-metal",
      "drive-disc:fanged-metal",
      "drive-disc:freedom-blues",
      "drive-disc:hormone-punk",
      "drive-disc:inferno-metal",
      "drive-disc:phaethon-s-melody",
      "drive-disc:polar-metal",
      "drive-disc:proto-punk",
      "drive-disc:puffer-electro",
      "drive-disc:shadow-harmony",
      "drive-disc:shockstar-disco",
      "drive-disc:soul-rock",
      "drive-disc:swing-jazz",
      "drive-disc:thunder-metal",
      "drive-disc:woodpecker-electro",
      "w-engine:bashful-demon",
      "w-engine:blazing-laurel",
      "w-engine:deep-sea-visitor",
      "w-engine:demara-battery-mark-ii",
      "w-engine:electro-lip-gloss",
      "w-engine:elegant-vanity",
      "w-engine:flamemaker-shaker",
      "w-engine:fusion-compiler",
      "w-engine:hailstorm-shrine",
      "w-engine:heartstring-nocturne",
      "w-engine:hellfire-gears",
      "w-engine:ice-jade-teapot",
      "w-engine:kaboom-the-cannon",
      "w-engine:marcato-desire",
      "w-engine:precious-fossilized-core",
      "w-engine:riot-suppressor-mark-vi",
      "w-engine:sharpened-stinger",
      "w-engine:slice-of-time",
      "w-engine:spring-embrace",
      "w-engine:starlight-engine",
      "w-engine:steel-cushion",
      "w-engine:the-brimstone",
      "w-engine:the-restrained",
      "w-engine:timeweaver",
      "w-engine:tusks-of-fury",
      "w-engine:weeping-cradle",
      "w-engine:weeping-gemini"
    ],
    "changed": [],
    "removed": []
  },
  "claims": {
    "added": [
      {
        "id": "clm_bangboo_7238e4d11f1b",
        "kind": "bangboo",
        "slotKey": "bangboo:ellen:shiyu_defense",
        "sourceId": "example-guide-a"
      },
      {
        "id": "clm_drive_disc_114c4678fd1f",
        "kind": "drive_disc",
        "slotKey": "drive_disc:ellen:shiyu_defense",
        "sourceId": "example-guide-a"
      },
      {
        "id": "clm_f2p_option_0005883bd5f4",
        "kind": "f2p_option",
        "slotKey": "f2p_option:ellen:w_engine:starlight-engine:shiyu_defense",
        "sourceId": "example-guide-a"
      },
      {
        "id": "clm_investment_faf123713b93",
        "kind": "investment",
        "slotKey": "investment:ellen:signature_w_engine:-",
        "sourceId": "example-guide-a"
      },
      {
        "id": "clm_rotation_b3b3b2c1725b",
        "kind": "rotation",
        "slotKey": "rotation:ellen+lycaon+soukaku:shiyu_defense",
        "sourceId": "example-guide-a"
      },
      {
        "id": "clm_substitute_f0f064bf0324",
        "kind": "substitute",
        "slotKey": "substitute:lycaon:anby:ellen:shiyu_defense",
        "sourceId": "maintainer"
      },
      {
        "id": "clm_synergy_57e8af828fc2",
        "kind": "synergy",
        "slotKey": "synergy:ellen+lycaon:shiyu_defense",
        "sourceId": "example-guide-a"
      },
      {
        "id": "clm_team_1146c77fa655",
        "kind": "team",
        "slotKey": "team:ellen+lycaon+soukaku:shiyu_defense",
        "sourceId": "example-guide-a"
      },
      {
        "id": "clm_team_6075bf646663",
        "kind": "team",
        "slotKey": "team:ellen+lycaon+soukaku:shiyu_defense",
        "sourceId": "example-stats-b"
      },
      {
        "id": "clm_team_8560cf154716",
        "kind": "team",
        "slotKey": "team:astra-yao+miyabi+yanagi:shiyu_defense",
        "sourceId": "example-guide-a"
      },
      {
        "id": "clm_team_e04d1b1384d9",
        "kind": "team",
        "slotKey": "team:nicole+qingyi+zhu-yuan:shiyu_defense",
        "sourceId": "example-guide-a"
      },
      {
        "id": "clm_tier_0118922b07ba",
        "kind": "tier",
        "slotKey": "tier:miyabi:anomaly:shiyu_defense",
        "sourceId": "example-stats-b"
      },
      {
        "id": "clm_tier_394ede30f5be",
        "kind": "tier",
        "slotKey": "tier:soukaku:support:shiyu_defense",
        "sourceId": "example-guide-a"
      },
      {
        "id": "clm_tier_3acab5cccba9",
        "kind": "tier",
        "slotKey": "tier:yanagi:anomaly:shiyu_defense",
        "sourceId": "example-guide-a"
      },
      {
        "id": "clm_tier_3c9302901624",
        "kind": "tier",
        "slotKey": "tier:miyabi:anomaly:shiyu_defense",
        "sourceId": "example-guide-a"
      },
      {
        "id": "clm_tier_3f3335ac5f92",
        "kind": "tier",
        "slotKey": "tier:lycaon:stun:shiyu_defense",
        "sourceId": "example-guide-a"
      },
      {
        "id": "clm_tier_46499499471d",
        "kind": "tier",
        "slotKey": "tier:qingyi:stun:shiyu_defense",
        "sourceId": "example-guide-a"
      },
      {
        "id": "clm_tier_496d44a84d1e",
        "kind": "tier",
        "slotKey": "tier:astra-yao:support:shiyu_defense",
        "sourceId": "example-guide-a"
      },
      {
        "id": "clm_tier_5e0dca51f3c3",
        "kind": "tier",
        "slotKey": "tier:ellen:attack:shiyu_defense",
        "sourceId": "example-stats-b"
      },
      {
        "id": "clm_tier_9a499d69aadc",
        "kind": "tier",
        "slotKey": "tier:burnice:anomaly:shiyu_defense",
        "sourceId": "example-guide-a"
      },
      {
        "id": "clm_tier_bb21b9a255cd",
        "kind": "tier",
        "slotKey": "tier:zhu-yuan:attack:shiyu_defense",
        "sourceId": "example-guide-a"
      },
      {
        "id": "clm_tier_bbb3d993ee2d",
        "kind": "tier",
        "slotKey": "tier:ellen:attack:shiyu_defense",
        "sourceId": "example-guide-a"
      },
      {
        "id": "clm_tier_f3e90be8abd4",
        "kind": "tier",
        "slotKey": "tier:nicole:support:shiyu_defense",
        "sourceId": "example-guide-a"
      },
      {
        "id": "clm_tier_fe76c8740915",
        "kind": "tier",
        "slotKey": "tier:hugo:attack:general",
        "sourceId": "example-guide-a"
      },
      {
        "id": "clm_usage_541be35a159d",
        "kind": "usage",
        "slotKey": "usage:ellen:usage_rate:shiyu_defense",
        "sourceId": "example-stats-b"
      },
      {
        "id": "clm_w_engine_92ce8bd945a9",
        "kind": "w_engine",
        "slotKey": "w_engine:ellen:shiyu_defense",
        "sourceId": "example-guide-a"
      }
    ],
    "changed": [],
    "refreshed": [],
    "removed": [],
    "statusChanged": []
  },
  "fromVersion": null,
  "generatedAt": "2026-10-27T12:00:00.000Z",
  "toVersion": "3.3-r1"
}
